{
  "$schema": "https://json-schema.org/draft/2020-12/schema",
  "$id": "state-reconciliation-record.schema.json",
  "title": "State Reconciliation Record",
  "description": "Compares one declaration with one observation. UNKNOWN is not MATCH. Divergence can require reassessment. No runtime discovery is implied.",
  "type": "object",
  "additionalProperties": false,
  "properties": {
    "schema_version": {
      "type": "string",
      "const": "1.0.0",
      "minLength": 1
    },
    "reconciliation_id": {
      "type": "string",
      "minLength": 1
    },
    "subject_id": {
      "type": "string",
      "minLength": 1
    },
    "configuration_digest": {
      "type": "string",
      "pattern": "^sha256:[a-f0-9]{64}$"
    },
    "declared_snapshot_ref": {
      "type": "string",
      "minLength": 1
    },
    "observed_snapshot_ref": {
      "type": "string",
      "minLength": 1
    },
    "evaluated_at": {
      "type": "string",
      "pattern": "^\\d{4}-\\d{2}-\\d{2}T\\d{2}:\\d{2}:\\d{2}Z$"
    },
    "outcome": {
      "type": "string",
      "enum": [
        "MATCH",
        "DIVERGENCE",
        "UNKNOWN"
      ],
      "minLength": 1
    },
    "reconciled_state": {
      "type": "string",
      "enum": [
        "MATCH",
        "DIVERGENCE",
        "UNKNOWN"
      ],
      "minLength": 1
    },
    "reassessment_required": {
      "type": "boolean"
    },
    "limitations": {
      "type": "array",
      "minItems": 1,
      "items": {
        "type": "string",
        "minLength": 1
      }
    },
    "reference_only": {
      "type": "boolean",
      "const": true
    },
    "authority_effect": {
      "type": "string",
      "const": "NONE",
      "minLength": 1
    }
  },
  "required": [
    "schema_version",
    "reconciliation_id",
    "subject_id",
    "configuration_digest",
    "declared_snapshot_ref",
    "observed_snapshot_ref",
    "evaluated_at",
    "outcome",
    "reconciled_state",
    "reassessment_required",
    "limitations",
    "reference_only",
    "authority_effect"
  ]
}
